{
  "$schema": "http://json-schema.org/draft-07/schema#",
  "title": "smallchat Manifest",
  "description": "Schema for smallchat provider manifest files",
  "type": "object",
  "required": ["id", "name", "tools", "transportType"],
  "definitions": {
    "compilerHint": {
      "type": "object",
      "description": "Compiler hint — steers how a tool is mapped into the selector table",
      "properties": {
        "selectorHint": {
          "type": "string",
          "description": "Additional semantic text appended to the tool description during embedding"
        },
        "pinSelector": {
          "type": "string",
          "description": "Pin this tool to a specific canonical selector, bypassing vector-based interning"
        },
        "aliases": {
          "type": "array",
          "items": { "type": "string" },
          "description": "Semantic aliases — additional intent phrases that should resolve to this tool"
        },
        "preferred": {
          "type": "boolean",
          "description": "Compile-time annotation: the intended tool when it collides with another (collision report only; does not affect dispatch ranking)"
        },
        "exclude": {
          "type": "boolean",
          "description": "Exclude this tool from compilation entirely"
        },
        "vendorMeta": {
          "type": "object",
          "description": "Vendor-defined opaque metadata"
        }
      }
    },
    "providerCompilerHints": {
      "type": "object",
      "description": "Provider-level compiler hints — defaults for all tools in this manifest",
      "properties": {
        "namespace": {
          "type": "string",
          "description": "Namespace prefix prepended to all selector canonicals"
        },
        "selectorHint": {
          "type": "string",
          "description": "Semantic context appended to all tool descriptions during embedding"
        },
        "vendorMeta": {
          "type": "object",
          "description": "Vendor-defined opaque metadata"
        }
      }
    }
  },
  "properties": {
    "id": {
      "type": "string",
      "description": "Unique provider identifier"
    },
    "name": {
      "type": "string",
      "description": "Human-readable provider name"
    },
    "version": {
      "type": "string",
      "description": "Provider version string"
    },
    "transportType": {
      "type": "string",
      "enum": ["mcp", "rest", "local", "grpc"],
      "description": "Transport mechanism for this provider"
    },
    "endpoint": {
      "type": "string",
      "description": "Endpoint URL for remote transports"
    },
    "compilerHints": {
      "$ref": "#/definitions/providerCompilerHints"
    },
    "tools": {
      "type": "array",
      "description": "Tool definitions",
      "items": {
        "type": "object",
        "required": ["name", "description", "inputSchema"],
        "properties": {
          "name": {
            "type": "string",
            "description": "Tool name"
          },
          "description": {
            "type": "string",
            "description": "What this tool does"
          },
          "providerId": {
            "type": "string",
            "description": "Provider that owns this tool"
          },
          "transportType": {
            "type": "string",
            "enum": ["mcp", "rest", "local", "grpc"]
          },
          "inputSchema": {
            "type": "object",
            "description": "JSON Schema for the tool's input arguments",
            "properties": {
              "type": { "type": "string" },
              "properties": { "type": "object" },
              "required": {
                "type": "array",
                "items": { "type": "string" }
              }
            }
          },
          "compilerHints": {
            "$ref": "#/definitions/compilerHint"
          }
        }
      }
    }
  }
}
