{
  "id": "github",
  "name": "GitHub",
  "transportType": "mcp",
  "tools": [
    {
      "name": "search_code",
      "description": "Search for code across GitHub repositories",
      "providerId": "github",
      "transportType": "mcp",
      "inputSchema": {
        "type": "object",
        "properties": {
          "query": { "type": "string", "description": "Search query" },
          "language": { "type": "string", "description": "Programming language filter" },
          "repo": { "type": "string", "description": "Repository to search in" }
        },
        "required": ["query"]
      }
    },
    {
      "name": "create_issue",
      "description": "Create a new issue in a GitHub repository",
      "providerId": "github",
      "transportType": "mcp",
      "inputSchema": {
        "type": "object",
        "properties": {
          "title": { "type": "string", "description": "Issue title" },
          "body": { "type": "string", "description": "Issue body in markdown" },
          "repo": { "type": "string", "description": "Repository (owner/name)" },
          "labels": { "type": "string", "description": "Comma-separated labels" }
        },
        "required": ["title", "repo"]
      }
    },
    {
      "name": "list_pull_requests",
      "description": "List pull requests for a repository",
      "providerId": "github",
      "transportType": "mcp",
      "inputSchema": {
        "type": "object",
        "properties": {
          "repo": { "type": "string", "description": "Repository (owner/name)" },
          "state": { "type": "string", "description": "Filter by state: open, closed, all", "enum": ["open", "closed", "all"] },
          "sort": { "type": "string", "description": "Sort by: created, updated, popularity", "enum": ["created", "updated", "popularity"] }
        },
        "required": ["repo"]
      }
    }
  ]
}
